{
  "schema_version": "1.0",
  "harness_guard_version": "0.0.2",
  "ruleset_version": "2026.08.13",
  "report_schema_version": "1.1",
  "tools": [
    {
      "tool": "claude-code",
      "rules": 5,
      "categories": [
        "retention",
        "telemetry"
      ],
      "rules_last_verified_version": "2.1.223",
      "rules_verified_date": "2026-08-13"
    },
    {
      "tool": "codex",
      "rules": 4,
      "categories": [
        "retention",
        "telemetry",
        "transfer"
      ],
      "rules_last_verified_version": "0.147.0",
      "rules_verified_date": "2026-08-13"
    },
    {
      "tool": "grok-build",
      "rules": 4,
      "categories": [
        "telemetry",
        "transfer"
      ],
      "rules_last_verified_version": "1.0.3",
      "rules_verified_date": "2026-08-13"
    }
  ],
  "commands": [
    "scan",
    "list",
    "explain",
    "version",
    "capabilities",
    "completions"
  ],
  "exit_codes": {
    "0": "no findings at/above --fail-on",
    "1": "findings at/above --fail-on",
    "2": "degraded or internal/usage error"
  }
}
